{
  "schema_version": "2.0",
  "plan_name": "12周体能恢复计划",
  "start_date": "2026-06-15",
  "end_date": "2026-09-06",
  "timezone": "Asia/Shanghai",
  "ai_summary": "改善睡眠，恢复手腕，提升体能",
  "tasks": [
    {
      "id": "t1",
      "title": "身体维护训练A",
      "type": "workout",
      "schedule": { "weekday": [1, 3, 5], "time": "07:30" },
      "exercises": [
        { "id": "e1", "name": "深蹲", "sets": 3, "reps": 10, "rest_sec": 60, "cue": "膝盖对准脚尖" },
        { "id": "e2", "name": "臀桥", "sets": 3, "reps": 12, "rest_sec": 45 },
        { "id": "e3", "name": "平板支撑", "sets": 3, "duration_sec": 30, "rest_sec": 30 }
      ],
      "phases": [
        {
          "week_from": 5,
          "week_to": 12,
          "exercises": [
            { "id": "e1", "name": "深蹲", "sets": 4, "reps": 10, "weight_kg": 10, "rest_sec": 60 },
            { "id": "e2", "name": "臀桥", "sets": 4, "reps": 12, "rest_sec": 45 },
            { "id": "e3", "name": "平板支撑", "sets": 3, "duration_sec": 45, "rest_sec": 30 }
          ]
        }
      ],
      "reminder": true
    },
    {
      "id": "t2",
      "title": "散步20分钟",
      "type": "habit",
      "schedule": { "daily": true, "time": "18:00" },
      "reminder": true
    },
    {
      "id": "t3",
      "title": "22:30准备睡觉",
      "type": "habit",
      "schedule": { "daily": true, "time": "22:30" },
      "reminder": true
    }
  ]
}
